{
  "schema_version": "1.0",
  "package": "robotics-assembly-foundation",
  "version": "0.1.0",
  "interfaces": [
    {
      "id": "robotics.interface.nema23_motor_mount.candidate.v1",
      "title": "NEMA 23-class motor-to-structure mount",
      "category": "mechanical_mount",
      "data_status": "candidate",
      "engineering_review": "required",
      "summary": "A motor-mount contract whose exact pilot, hole pattern, fastener, clearance, shaft height, and tolerance requirements must be read from the selected motor drawing.",
      "sources": ["oriental_motor_pkp_nema23_2026"],
      "applies_to": ["robotics.component.nema23_stepper_candidate.v1", "robotics.component.linear_axis_motor_mount.illustrative.v1"],
      "contract": {
        "frame_convention": ["Origin: selected motor drawing's mounting-face datum after review.", "Positive Z: from motor mounting face toward shaft unless the controlled drawing states otherwise.", "Positive X: defined by a selected mounting-hole or keyed feature; do not use an arbitrary CAD orientation.", "Frame handedness: right-handed and recorded in the AssemblyGraph."],
        "required_inputs": ["exact motor part number", "current controlled mounting drawing", "mount material/process", "pulley centreline datum", "fasteners and thread engagement", "motor cable clearance"],
        "constraints": ["Motor-class names are not dimensional interface definitions.", "Mount must preserve belt-line alignment and permit required assembly/service access.", "Mounting, pilot, and fastener tolerances must come from the selected supplier drawing."],
        "verification": ["Attach the selected controlled drawing/revision.", "Check CAD hole pattern, pilot/clearances, and shaft centreline against the drawing.", "Run interference and assembly-tool-access checks.", "Review mount stiffness and resonance for the selected motion profile."]
      },
      "agent_guidance": "Do not emit coordinates or hole diameters until this candidate interface has been resolved to an exact motor drawing."
    },
    {
      "id": "robotics.interface.motor_shaft_to_timing_pulley.candidate.v1",
      "title": "Motor shaft to timing pulley",
      "category": "motion_transmission",
      "data_status": "candidate",
      "engineering_review": "required",
      "summary": "A rotating-shaft interface requiring a selected shaft geometry, pulley bore, retention method, torque load, radial load, and pulley runout requirement.",
      "sources": ["gates_powergrip_gt3_2026", "oriental_motor_pkp_nema23_2026"],
      "applies_to": ["robotics.component.nema23_stepper_candidate.v1", "robotics.component.timing_pulley_candidate.v1"],
      "contract": {
        "frame_convention": ["Origin: intersection of shaft axis and motor mounting-face datum.", "Z axis: shaft axis from motor toward pulley.", "X axis: selected keyed/flat/index feature, if supplied.", "Frame handedness: right-handed."],
        "required_inputs": ["selected motor shaft drawing", "selected pulley drawing", "torque/speed duty cycle", "belt radial load", "retention method", "axial clearance and assembly sequence"],
        "constraints": ["Belt tooth profile and pulley profile must match.", "Do not assume a plain bore, key, D-flat, set screw, clamp, or interference fit.", "Pulley alignment must be evaluated in the loaded assembly, not only nominal CAD."],
        "verification": ["Check bore and shaft features against current drawings.", "Check transmitted torque and radial load against selected components.", "Check pulley runout/alignment and belt tracking.", "Check retention, assembly access, and service removal."]
      },
      "agent_guidance": "Use this as a blocking contract for CAD mating, not as an authorization to select a bore or a set screw."
    },
    {
      "id": "robotics.interface.timing_belt_drive.candidate.v1",
      "title": "Synchronous timing-belt drive",
      "category": "motion_transmission",
      "data_status": "candidate",
      "engineering_review": "required",
      "summary": "A candidate belt-drive contract joining a selected belt, pulleys, idlers, tensioner, and carriage termination. It must be sized using the chosen supplier's current method.",
      "sources": ["gates_powergrip_gt3_2026"],
      "applies_to": ["robotics.component.gates_powergrip_gt3_belt_candidate.v1", "robotics.component.timing_pulley_candidate.v1", "robotics.component.linear_axis_carriage_plate.illustrative.v1"],
      "contract": {
        "frame_convention": ["Origin: motor pulley pitch-circle centre after exact pulley selection.", "X axis: nominal belt travel direction.", "Z axis: selected pulley axis.", "Frame handedness: right-handed."],
        "required_inputs": ["exact belt/pulley profile", "pitch length and width", "pulley tooth counts", "centre distances", "motion/load cycle", "tensioning and clamp geometry"],
        "constraints": ["The belt, pulley, idler, and clamp must be compatible with the selected profile and width.", "Belt travel must avoid interference through the full carriage stroke.", "Preload/tension, tooth engagement, and allowable load are supplier-calculation outputs, not generic constants."],
        "verification": ["Run the selected vendor sizing method.", "Check belt path and clearances at all travel limits.", "Check tensioning adjustment range and clamp geometry.", "Document the selected belt and pulley part numbers/revisions."]
      },
      "agent_guidance": "Never call a belt drive valid merely because a belt path looks plausible in CAD. Require a selected profile and a documented sizing result."
    },
    {
      "id": "robotics.interface.belt_termination_to_carriage.candidate.v1",
      "title": "Timing-belt termination to carriage",
      "category": "mechanical_mount",
      "data_status": "candidate",
      "engineering_review": "required",
      "summary": "A carrier interface for a supplier-approved or custom belt clamp. It must preserve belt pitch, withstand cyclic load, and avoid sharp bending or tooth damage.",
      "sources": ["gates_powergrip_gt3_2026"],
      "applies_to": ["robotics.component.gates_powergrip_gt3_belt_candidate.v1", "robotics.component.linear_axis_carriage_plate.illustrative.v1"],
      "contract": {
        "frame_convention": ["Origin: centre of carriage payload datum projected to belt pitch line.", "X axis: travel direction.", "Y axis: lateral axis across belt width.", "Z axis: normal to carriage mounting face."],
        "required_inputs": ["selected belt profile/width", "clamp design or supplier part", "maximum tension and cyclic load", "carriage plate material", "assembly/service access"],
        "constraints": ["Do not use an unverified clamp geometry for a selected belt.", "Clamp must not introduce a collision through travel or compromise guideway alignment.", "Mount must preserve intended load path and belt plane."],
        "verification": ["Check belt bend and tooth engagement at termination.", "Check clamp strength/fatigue with qualified review.", "Check full-stroke interference.", "Check assembly and retensioning access."]
      },
      "agent_guidance": "Keep this interface unresolved until the belt profile and a clamp strategy have been selected."
    },
    {
      "id": "robotics.interface.linear_guide_rail_to_structure.candidate.v1",
      "title": "Linear guide rail to structural frame",
      "category": "mechanical_mount",
      "data_status": "candidate",
      "engineering_review": "required",
      "summary": "A datum-critical rail mounting contract. Exact rail mounting pattern, seat geometry, straightness, fastening, torque, shimming, and assembly method depend on the selected guideway and frame.",
      "sources": ["hiwin_mg_linear_guideways_2026"],
      "applies_to": ["robotics.component.hiwin_mg_linear_guide_candidate.v1", "robotics.component.linear_axis_structure.illustrative.v1", "robotics.component.parallel_jaw_gripper_body.illustrative.v1"],
      "contract": {
        "frame_convention": ["Origin: selected rail datum at the designated assembly end.", "X axis: rail travel direction.", "Y axis: lateral direction across rail width.", "Z axis: normal to rail mounting plane; right-handed."],
        "required_inputs": ["exact rail/block drawing", "rail length and datum end", "frame material/process", "mounting-surface tolerance", "fastener plan", "alignment/installation procedure"],
        "constraints": ["Do not infer rail-hole spacing, thread size, seat dimensions, or installation tolerance from family name.", "Rail mounting must be assessed with the structural stiffness and intended load/moment directions.", "A CAD mate is not a substitute for a manufacturing alignment method."],
        "verification": ["Attach current rail drawing.", "Check mounting features/datum scheme in CAD and drawing.", "Review mounting-surface flatness/parallelism requirements.", "Check full-travel clearance and lubrication/service access."]
      },
      "agent_guidance": "Treat the selected rail's drawing and installation manual as the source of truth for all physical interface values."
    },
    {
      "id": "robotics.interface.linear_guide_carriage_to_plate.candidate.v1",
      "title": "Linear guide carriage block to moving plate",
      "category": "mechanical_mount",
      "data_status": "candidate",
      "engineering_review": "required",
      "summary": "A moving-plate interface for selected guide blocks. Exact mounting holes, screw length, torque, counterbores, engagement, plate stiffness, and guide-block load sharing remain selection-specific.",
      "sources": ["hiwin_mg_linear_guideways_2026"],
      "applies_to": ["robotics.component.hiwin_mg_linear_guide_candidate.v1", "robotics.component.linear_axis_carriage_plate.illustrative.v1"],
      "contract": {
        "frame_convention": ["Origin: selected carriage block mounting datum.", "X axis: travel direction.", "Y axis: across rail width.", "Z axis: normal to plate mounting plane; right-handed."],